,CompanyName,Rating,Reviews,Salaries,Jobs,Location,Industry,Description
0,Accenture,4.1,1.5L,78.6T,27.3T,Bengaluru,Business Consulting,"Growing customer expectations. Market-Shaping AI. Self-Optimizing systems. The post-digital age shows no signs of slow down, and the need for the new ideas powered by intelligent technologies has never been greater. A vision for the future can’t be realized without know-how. Accenture partners with our clients drive real innovation – the kind that turns an idea into an industry – helping them transform and grow their organizations. Learn how we work with companies from all industries across the globe to create the New, now."
1,Deloitte,4.1,1L,34T,35.3T,Bengaluru,Accounting & Tax,"Deloitte provides industry-leading audit and assurance, tax and legal, consulting, financial advisory, and risk advisory services to nearly 90% of the Fortune Global 500® and thousands of private companies. Our more than 412,000+ professionals deliver measurable and lasting results that help reinforce public trust in capital markets, enable clients to transform and thrive, and lead the way toward a stronger economy, a more equitable society and a sustainable world. Building on its 178-plus year history, Deloitte spans more than 150 countries and territories. Deloitte US-India Offices is part of region within the Deloitte US organization, with offices across four cities in India — Hyderabad, Mumbai, Delhi-NCR, Bengaluru, Kolkata, Pune and Chennai."
2,Cisco Systems,4.4,31.7T,8T,438,Bengaluru,Enterprise Software & Network Solutions,"#WeAreCisco, where each person is unique. We bring our talents to work as a team each day, helping power an inclusive future for all. Here's how we do it. At Cisco, we embody transformation and help our customers excel in their digital worlds. Some may think we're ""old"" (36+ years strong!) and only about hardware, but we're also a software company, a security company, a blockchain company, and an AI/Machine Learning company. We even invented an intuitive network that adapts, predicts, learns, and protects. Our innovation never stops! Cisco values the perspectives and skillsets that arise from employees with diverse backgrounds. That's why Cisco is expanding the boundaries of discovering top talent by not only focusing on candidates with college degrees and experience but instead placing more emphasis on unlocking potential. As one of the leading forces in connecting the world, we understand our unique opportunity to bring communities together and create meaningful change for everyone, everywhere. That's why connecting starts within Cisco. Over 30,000 Cisconians participate in our Employee Resource Groups, called Inclusive Communities, where we network, learn to be informed allies, and help make a difference. Cisco didn't just build the Internet. We keep building it. And while our technology helps connect the unconnected, that's not where our edge comes from. It comes from our people—unique, innovative, and diverse. Be you, with us!"
3,Dell Technologies,4.3,33.3T,9.9T,136,Bengaluru,Information Technology Support Services,"We believe that each of us has the power to make an impact. That’s why we put our team members at the center of everything we do. If you’re looking for an opportunity to grow your career with some of the best minds and most advanced tech in the industry, we’re looking for you. Dell Technologies is a unique family of businesses that helps individuals and organizations transform how they work, live and play. Join us to build a future that works for everyone because Progress Takes All of Us. Dell is a collective of customer-obsessed, industry-leading visionaries. At our core is a commitment to diversity, sustainability and our communities. We offer unparalleled growth and development opportunities for our team members. We believe that technology is essential for driving human progress, and we’re committed to providing that technology to people and organizations everywhere, so they can transform the way they work and live."
4,Microsoft,4.3,49.7T,9.9T,1.6T,Bengaluru,Computer Hardware Development,"Our drive to change the world unites us! Microsoft is the ideal place for people who have passion for their work and the desire to make an impact—in their careers, in the community and on the world. Microsoft is a unique company; and not just within the tech industry. Here, smart people thrive on their own terms and push their intelligence to its limit. The variety of job opportunities and career advancement at Microsoft is incredible and empowers you to constantly challenge yourself and chart your own course."
5,Google,4.4,45.8T,8.5T,1.8T,Bengaluru,Internet & Web Services,"Since our founding in 1998, Google has grown by leaps and bounds. Starting from two computer science students in a university dorm room, we now have over a hundred thousand employees and over one hundred offices around the world. These Googlers build products that help create opportunities for everyone, whether down the street or across the globe. So whether you want to be a part of developing innovative technology, campaigns, products or partnerships, your work here is a chance to accomplish things that matter. To learn more about our job opportunities, teams, offices, benefits and workplace culture, visit careers.google.com."
6,Intel Corporation,4.1,29.3T,4.2T,1.3T,Bengaluru,Computer Hardware Development,
7,SAP,4.4,28.4T,5.1T,2T,Bengaluru,Enterprise Software & Network Solutions,"As market leader in enterprise application software, SAP helps companies of all sizes and industries run better. From back office to boardroom, warehouse to storefront, desktop to mobile device – SAP empowers people and organizations to work together more efficiently and use business insight more effectively to stay ahead of the competition. SAP helps simplify technology for companies of all sizes so they can consume our software the way they want – and without disruption. With an extensive global network of customers, partners, employees, and thought leaders around the world, SAP helps the world run better and improve people’s lives. For more information, visit https://jobs.sap.com"
8,Mindtree,4.0,11.1T,9.9T,--,https://www.mindtree.com/about/locations,Information Technology Support Services,"Mindtree [NSE: MINDTREE] is a global technology consulting and services company that enables enterprises across industries to drive superior competitive advantage, customer experiences and business outcomes by harnessing digital and cloud technologies. A digital transformation partner to approximately 276 of the world’s most pioneering enterprises, Mindtree brings extensive domain, technology and consulting expertise to help reimagine business models, accelerate innovation and maximize growth. As a socially and environmentally responsible business, Mindtree is focused on growth as well as sustainability in building long-term stakeholder value. Powered by more than 38,290 talented and entrepreneurial professionals across 24 countries, Mindtree — a Larsen & Toubro Group company — is consistently recognized among the best places to work."
9,Honeywell,4.0,20.4T,5.6T,2.8T,Bengaluru,Computer Hardware Development,We have been innovating for more than 100 years – and now we’re creating what’s next.
10,J.P. Morgan,4.1,23.5T,7.4T,15,Bengaluru,Investment & Asset Management,"J.P. Morgan is a leader in financial services, offering solutions to clients in more than 100 countries with one of the most comprehensive global product platforms available. We have been helping our clients to do business and manage their wealth for more than 200 years. Our business has been built upon our core principle of putting our clients' interests first. We have been a key player in the economic development of India, with a legacy going back 100 years. After having a presence in India for many years, we established our first representative office in Mumbai in 1945, and J.P. Morgan has been providing first-class service to clients in the country since then. Today, the firm has presence across the country - in Mumbai, Bengaluru, Hyderabad, New Delhi, Chennai, Pune, Ahmedabad and Noida. Our India franchise provides a comprehensive range of services including Corporate and Investment banking, Commercial Banking and Asset & Wealth Management. Our India Corporate Centers provide 24x7 global support for every division of the firm around the world, including Consumer and Community Banking. J.P. Morgan is part of JPMorgan Chase & Co. (NYSE: JPM), a global financial services firm. © 2023 JPMorgan Chase & Co. All rights reserved. JPMorgan Chase is an Equal Opportunity Employer, including Disability/Veterans"
11,Hewlett Packard Enterprise | HPE,4.2,16.9T,3.9T,875,Bengaluru,Information Technology Support Services,"At Hewlett Packard Enterprise, we are changing the world together. We’re advancing the way people live, work and communicate. With a culture that thrives on finding new and better ways to accelerate what's next, we offer businesses the opportunity to turn insights into outcomes. We do this by making Hybrid IT simple, powering the Intelligent Edge, and providing the expertise to make it happen. What starts here changes the world."
12,Qualcomm,4.1,9.8T,3.8T,--,Bengaluru,Computer Hardware Development,"We’re looking for inventive minds to help fuel what’s next in 5G. Qualcomm is the wireless technology innovator and the company of inventors that unlocked 5G. We’re ushering in an age of rapid acceleration in wireless connectivity that’s transforming entire industries and enriching lives on a global scale. From smartphones to smart homes, mobile PCs to automotive, gaming to XR/VR/AR, and audio to factories of the future, 5G may be the most important technological development of the 21 st century — and Qualcomm is leading the way. But this is just the beginning. It takes brilliant minds with diverse skills, backgrounds, and cultures to transform 5G’s potential into world-changing technologies and products. This is the Invention Age — and this is where you come in."
13,Concentrix,4.3,30.4T,9.1T,1.8T,Bengaluru,Information Technology Support Services,"In a world full of average, we stand out. We believe experience is everything. Period. To achieve outstanding results, we’re disrupting the market by being absolutely obsessed with making our clients’ businesses better. We bring together the brightest and most creative minds in business, cutting-edge technology solutions, proven design thinking expertise and exceptional customer experience centers. Our clients notice the difference too… in increased customer loyalty, improved business performance and differentiation in their markets. As a diverse, global organization, we have unconventionally fresh ideas and deliver extraordinary customer experiences for more than 450 of the world’s best brands. Concentrix. A passionate company powered by passionate people."
14,Nokia,4.2,17.8T,4.9T,832,Bengaluru,Telecommunications Services,"Join us in creating the technology that helps the world act together. We are a B2B technology innovation leader pioneering the future where networks meet cloud. At Nokia you will have a positive impact on people’s lives and help build the capabilities needed for a more productive, sustainable, and accessible world. Be part of a culture built on an inclusive way of working where we are open to your ideas, you are empowered to take risks and are encouraged to be fearless in bringing your authentic self to work. www.nokia.com/careers"
15,Robert Bosch,4.3,15.2T,4.4T,262,Bengaluru,Computer Hardware Development,"The Bosch Group is a leading global supplier of technology and services. It employs roughly 421,300 associates worldwide (as of December 31, 2022). The company generated sales of 88.2 billion euros in 2022. Its operations are divided into four business sectors: Mobility Solutions, Industrial Technology, Consumer Goods, and Energy and Building Technology. As a leading IoT provider, Bosch offers innovative solutions for smart homes, Industry 4.0, and connected mobility. Bosch is pursuing a vision of mobility that is sustainable, safe, and exciting. It uses its expertise in sensor technology, software, and services, as well as its own IoT cloud, to offer its customers connected, cross-domain solutions from a single source. The Bosch Group’s strategic objective is to facilitate connected living with products and solutions that either contain artificial intelligence (AI) or have been developed or manufactured with its help. Bosch improves quality of life worldwide with products and services that are innovative and spark enthusiasm. In short, Bosch creates technology that is “Invented for life.” The Bosch Group comprises Robert Bosch GmbH and its roughly 470 subsidiary and regional companies in over 60 countries. Including sales and service partners, Bosch’s global manufacturing, engineering, and sales network covers nearly every country in the world. With its more than 400 locations worldwide, the Bosch Group has been carbon neutral since the first quarter of 2020. The basis for the company’s future growth is its innovative strength. At 136 locations across the globe, Bosch employs some 85,500 associates in research and development, of which nearly 44,000 are software engineers. Website: https://www.bosch.com/careers Instagram: https://www.instagram.com/boschglobal/ Facebook: https://www.facebook.com/BoschGlobal Twitter: https://www.twitter.com/BoschGlobal Imprint: www.bosch.com/corporate-information Privacy statement: www.bosch.com/data-protection-notice"
16,JPMorgan Chase & Co,4.0,23.5T,3.6T,5.5T,Bengaluru,Banking & Lending,"JPMorgan Chase is one of the world's oldest, largest and best-known financial institutions. With a history that traces our roots to 1799 in New York City, we carry forth the innovative spirit of our heritage firms in our global operations in over 60 countries. We serve millions of customers and many of the world’s most prominent corporate, institutional, and government clients-managing assets and investments, offering business advice and strategies, and providing innovative banking solutions and services. © 2023 JPMorgan Chase & Co. All rights reserved. JPMorgan Chase is an Equal Opportunity Employer, including Disability/Veterans."
17,Siemens,4.1,20.4T,4.5T,11.3T,"No. 84, Keonics, Electronics City, Hosur Road",Electronics Manufacturing,"Siemens is a global powerhouse focusing on the areas of electrification, automation and digitalization. In 1908, the company established a Technical Bureau in Singapore as a sales office of the London-based Siemens Brothers Dynamo Works Limited, to search for new business opportunities in the then flourishing British colony. More than 100 years on, Siemens has grown with Singapore, and has helped to develop the Lion City into the modern, economic powerhouse it is today."
18,VMware,4.5,10.9T,3.3T,778,"Kalyani Vista, 192A, 3rd Main Rd, Doresanipalya, Anthappa Layout, Phase 4, J. P. Nagar, Bengaluru, Karnataka",Enterprise Software & Network Solutions,"VMware is a leading provider of multi-cloud services for all apps, enabling digital innovation with enterprise control. With VMware Cross-Cloud™ services and our global ecosystem of partners, we deliver the smartest path to cloud, edge, and app modernization. Our technology also supports multi-cloud autonomy for developers and consistent operations for DevSecOps—while creating a more secure, frictionless experience for the distributed workforce. As the trusted foundation to accelerate innovation, VMware preserves customer choice and protects against lock-in. Instead of tradeoffs and compromises, our software offers businesses the freedom and flexibility they need to build the future."
19,IQVIA,4.0,12.9T,4T,2.1T,Bengaluru,Biotech & Pharmaceuticals,"IQVIA (NYSE:IQV) is a leading global provider of advanced analytics, technology solutions and clinical research services to the life sciences industry dedicated to delivering actionable insights. Learn more at jobs.iqvia.com."
20,Fidelity Investments,4.3,14.9T,2.5T,1.2T,Bengaluru,Investment & Asset Management,"Fidelity Investments is one of the world’s largest providers of financial services. Headquartered in Boston, US, Fidelity’s goal is to make financial expertise broadly accessible and effective in helping people live the lives they want. Fidelity focuses on meeting the unique needs of a diverse set of customers: helping more than 25 million people invest their own life savings, nearly 20,000 businesses manage their employee benefit programs, as well as providing nearly 10,000 advisory firms with investment and technology solutions to invest their own clients’ money. Privately held for nearly 70 years, Fidelity employs 47,000 associates who are focused on the long-term success of our customers."
21,Morgan Stanley,3.9,17.7T,3.4T,835,3 office locations in Bengaluru,Investment & Asset Management,"Morgan Stanley mobilizes capital to help governments, corporations, institutions and individuals around the world achieve their financial goals. For over 85 years, the firm’s reputation for using innovative thinking to solve complex problems has been well earned and rarely matched. A consistent industry leader throughout decades of dramatic change in modern finance, Morgan Stanley will continue to break new ground in advising, serving and providing new opportunities for its clients. Morgan Stanley is committed to maintaining the first-class service and high standard of excellence that have always defined the firm. At its foundation are five core values — putting clients first, doing the right thing, leading with exceptional ideas, committing to diversity and inclusion, and giving back — that guide its more than 80,000 employees in 1,200 offices across 41 countries. Morgan Stanley has been operating in India for over 28 years, providing a variety of services to domestic and international clients. The firm has a premier institutional securities platform in India, offering a full range of investment banking, capital markets, equities, fixed income, commodities and derivative products, as well as research. Discover what makes Morgan Stanley such a great place to work by using the resources on this page to learn more about our people, our business and our heritage."
22,GE,4.0,18.3T,2.3T,1.2T,"Unit No.1, 4th Floor,Inventor Building, ITPL, Whitefield",Machinery Manufacturing,"For more than 125 years, GE has invented the future of industry, and today the company’s dedicated team, leading technology, and global reach and capabilities help the world work more efficiently, reliably, and safely. GE’s people are diverse and dedicated, operating with the highest level of integrity and focus to fulfill GE’s mission and deliver for its customers."
23,Teleperformance,4.5,49.8T,8.5T,1.2T,Bengaluru,Telecommunications Services,"Passion. Integrity. Excellence. We are Teleperformance, the worldwide leader in outsourced omnichannel customer experience management. For almost four decades, we have been helping our clients across 80 countries serving 175 markets strengthen their relationships with their customers by providing customer care, technical support, customer acquisition, digital solutions, analytics, and other specialized services. Aon, Great Place to Work, the Everest Group and many others have recognized our expertise in different fields. As a people company, we want to be the bridge that connects you to great opportunities. Allow us to take your career to new places. With your passion and our mission, we can do great things together. Ready to take that first step? We want to hear from you."
24,Schneider Electric,4.2,13.9T,3T,3.5T,Bengaluru,Energy & Utilities,"At Schneider, we believe access to energy and digital is a basic human right. We empower all to make the most of their energy and resources, ensuring Life Is On everywhere, for everyone, at every moment. We provide energy and automation digital solutions for efficiency and sustainability. We combine world-leading energy technologies, real-time automation, software and services into integrated solutions for Homes, Buildings, Data Centers, Infrastructure and Industries. We are committed to unleash the infinite possibilities of an open, global, innovative community that is passionate about our Meaningful Purpose, Inclusive and Empowered values. -135,000+ employees -100+ countries -27.2B Euro in revenue (FY2019)"
25,Flipkart,4.0,5T,6.9T,89,"Flipkart Internet Private Limited, Buildings Alyssa, Begonia & Clove Embassy Tech Village, Outer Ring Road, Devarabeesanahalli Village, Bangalore, Karnataka, IN",Internet & Web Services,"Flipkart is committed to transforming commerce in India through investments in made-in-India technology innovations, customer-centric constructs, a diverse category landscape and a world-class supply chain. With a customer base of over 350 million, product coverage of over 150 million across 80+ categories, a focus on generating direct and indirect employment and a commitment to empowering generations of entrepreneurs and MSMEs, all driven by a sustainable growth strategy – Flipkart is maximising for customers, stakeholders, and the planet at large! At Flipkart, our promise to every Flipster is - getting an opportunity to leave a mark and create their own legacy, the freedom to experiment, learn and grow, work with the industry’s brightest minds as part of a diverse team and we will extend our culture of care to them to ensure that they can focus on doing their best work. Driven by audacity, bias for action, customer first, integrity and inclusion – Flipsters have pioneered solutions that have transformed digital commerce in India. From the industry-first introduction of cash-on-delivery in 2010 to the launch of voice search and multiple vernacular interfaces in 2021 that have made e-commerce a very inclusive experience, Flipkart continues the exciting journey of solving for the Indian customer. We understand that your own aspirations and journeys are unique. So you choose what you want to maximise, and we provide you the platform for it. Because when you maximise, we maximise. Explore opportunities at www.flipkartcareers.com. Flipkart is a part of the Walmart-owned Flipkart Group, which also includes group companies Flipkart Wholesale, Myntra, and Cleartrip. The Group is also a majority shareholder in PhonePe, one of the leading Payments Apps in India."
26,Adobe,4.4,8.9T,4.2T,445,Bengaluru,Computer Hardware Development,"Adobe is the global leader in digital media and digital marketing solutions. Our creative, marketing and document solutions empower everyone – from emerging artists to global brands – to bring digital creations to life and deliver immersive, compelling experiences to the right person at the right moment for the best results. In short, Adobe is everywhere, and we’re changing the world through digital experiences."
27,Shell,4.1,13.2T,2T,1.1T,Bengaluru,Energy & Utilities,"Shell is an international energy company with expertise in the exploration, production, refining and marketing of oil and natural gas, and the manufacturing and marketing of chemicals. We use advanced technologies and take an innovative approach to help build a sustainable energy future. We invest in power, including from renewable sources such as wind and solar. We also invest in electric vehicle charging and low-carbon fuels for transport, such as advanced biofuels and hydrogen. Together at Shell, we are transitioning to become a net-zero emissions business while providing the energy that people around the world need today. Working with experienced colleagues on this important challenge, you’ll have the opportunity to develop the skills you need to grow, in an environment where we value honesty, integrity and respect for one another. At Shell, you progress as we tackle the energy challenge together."
28,HP Inc.,4.2,9.3T,2T,1.1T,Bengaluru,Computer Hardware Development,"From day one, HP broke new ground by refusing to accept the status quo. Bill Hewlett and Dave Packard created more than an audio oscillator in their Palo Alto garage. They built a way of doing business—the HP Way. What started in Bill and Dave’s garage still thrives today. We continue to change the world with our products, our people, and our business practices. Reinvention is the key. It is the accelerant to growth. It drives us to create experiences that amaze. Keep reinventing. It’s what we do."
29,Salesforce,4.3,17.3T,2.5T,992,"Torrey Pines, Third Floor, Embassy Golf Links Business Park, Varthur Hobli, Challaghatta Village, Bangalore Urban, Karnataka,",Enterprise Software & Network Solutions,"Salesforce is an online customer relationship management, or CRM, solution. It offers all your teams, including marketing, sales, commerce and service, a shared view of your customers thanks to an integrated CRM platform."
