,CompanyName,Rating,Reviews,Salaries,Jobs,Location,Industry,Description
332,Seven Lakes Technologies,4.2,354,47,6,"1st Floor, Office No. 1103, WeWork, Block L, Embassy Tech Village, Outer Ring Rd",Computer Hardware Development,"Seven Lakes Technologies reimagines how companies engage with and use their insights. We help shape your business by equipping individuals at every level of an organization with data that lets them make a difference. Seven Lakes aligns people to drive meaningful change and create a thriving organization. With the ability to share and act toward your collective vision, your doers become difference-makers—inspired to impact the larger whole. Seven Lakes was founded in 2009 by Shiva Rajagopalan, an oil and gas industry expert, who developed an enterprise software platform designed to give upstream O&amp;G operators better insight into the data they need to eliminate inefficiencies in their drilling and production operations. The company’s technology visualizes over 100,000 wells and serves more than 30 independent and mid-major oil companies across the country including Denver, Houston, Dallas, Midland, Pittsburgh and Oklahoma City."
333,SLB,4.0,11.5T,957,389,Bengaluru,Energy & Utilities,"No sleeper, Schlumberger (pronounced SHLUM-ber-ZHAY) is one of the world's largest oilfield services companies, along with Halliburton. It provides a full range of services, including seismic surveys, formation evaluation, drilling technologies and equipment, cementing, well construction and completion, and project management. Schlumberger also provides reservoir evaluation, development, and management services, and is developing new technologies for reservoir optimization. Through its WesternGeco business, the company provides seismic and other surveying services to customers worldwide. In 2010 Schlumberger acquired drilling services giant Smith International in deal valued at $11 billion."
334,BRIDGEi2i,4.0,221,332,--,Bengaluru,Business Consulting,"BRIDGEi2i, part of Accenture Applied Intelligence, is a trusted partner to enterprises for enabling AI-powered digital transformation. We help enterprises reimagine business processes with AI by leveraging our consultative problem-solving approach, end-to-end AI capabilities, and proprietary pre-built algorithmic engines. BRIDGEi2i enables businesses to contextualize data, generate actionable insights to solve complex business problems, accelerate data-driven decision-making, and drive faster time to value. We make the AI experience real for enterprises to power superior customer experience and drive sustainable business impact."
335,Mobile Premier League,4.0,272,393,--,"Sakti Statesman, 6th Floor · Green Glen Layout, Bellandur · Bengaluru, Karnataka 560103",Video Game Publishing,"We are MPL, India’s biggest mobile eSports platform. Every day thousands of users join us to play their favourite mobile games and win amazing rewards. From simple skill-based games like Fruit Chop and Runner No. 1 to more immersive experiences like Pool and Pro Cricket, we have it all (almost). MPL believes there is a Hero in everyone who is hungry for more- more challenges, more wins, and more accolades. With hundreds of tournaments and contests running each day we provide our users with a gaming experience that’s unparalleled. Backed by our fast growing user base and marquee investors like Sequoia Capital, we are consistently moving towards our goal to make mobile Esports a household name in India. We are a small and eclectic team of gaming geeks and engineering mavens and we are looking to grow our league."
336,Nagravision,4.1,361,206,6,Bengaluru,Broadcast Media,"The Kudelski Group is a global leader in digital security and convergent media solutions for the delivery of digital and interactive content. Its technologies are used in a wide range of services and applications requiring access control and rights management. Its three main activity sectors include integrated Digital Television, cyber security solutions and Public Access solutions"
337,Pramati Technologies,4.3,653,611,--,"15th Fl, WTC, Brigade Gateway, Malleswaram",Enterprise Software & Network Solutions,"Pramati was founded as a web technology company in 1998 by Jay Pullur and Vijay Pullur in Hyderabad, India. Today, we are 1500+ engineers across Hyderabad, Chennai, Bangalore, Mountain view & London. Our Portfolio consists of: Imaginea - Innovation as a service Wavemaker - Low code app development platform Hyscale - Accelerate Kubernetes app delivery Thumb Sign-in - Strong Authentication platform Spotcues - Micro-apps platform Apitive - API portfolio management Chatlets - Micro-conversions platform"
338,Amazon Development Centre,4.0,552,741,--,Bengaluru,N/A,
339,ZestMoney,4.3,270,338,--,Bengaluru,Banking & Lending,"ZestMoney is the largest and fastest growing digital lending platform In India that provides consumers with direct access to loans through a fast, convenient and transparent experience. ZestMoney is India's first virtual EMI, enabling credit...without the card. It is India’s first completely automated lending platform designed for underserved consumers. It offers configurable digital products, instant approval, and the best user experience in the market (NPS of 73). ZestMoney has built a platform to drive financial inclusion by meaningfully improving the lives of more than 300 million households who currently have no access to credit cards or any other formal financing options because of insufficient credit history. ZestMoney is an Indian technology company, and loans are issued by fully regulated lending institutions."
340,BSH Hausgeräte,4.0,1T,156,416,Bengaluru,Consumer Electronics & Appliances Stores,"BSH Home Appliances Group is the largest manufacturer of home appliances in Europe and one of the leading companies in the sector worldwide. With a portfolio of 14 brands, BSH covers a wide range of consumer needs. Alongside the Global Brands Bosch and Siemens as well as Gaggenau and Neff, the portfolio comprises the Local Heroes Thermador, Balay, Coldex, Constructa, Pitsos, Profilo, Ufesa and Zelmer, as well as the Label Brands Junker and Viva. Founded in 1967 as a joint venture of Robert Bosch GmbH (Stuttgart) and Siemens AG (Munich), BSH has belonged exclusively to the Bosch Group since January 2015. With around 62.000 employees, BSH increased its revenue in 2021 to around 15.6 billion euros. BSH has some 40 factories worldwide and produces the entire range of modern home appliances. This ranges from cookers, ovens and extractor hoods, dishwashers, washing machines, dryers, fridges and freezers to small appliances (Consumer Products) such as vacuum cleaners or coffee machines."
341,Apptio,4.1,525,115,95,Bengaluru,Enterprise Software & Network Solutions,"Apptio is the independent software-as-a-service leader in technology business management (TBM), a new category and discipline backed by global IT leaders that helps you understand the cost, quality, and value of the services you provide."
342,Hilti Group,4.1,2.6T,359,350,Bengaluru,Construction,"Hilti provides leading-edge technology to the global construction industry. Hilti products, systems and services offer the construction professional innovative solutions with outstanding added value. The headquarters of the Hilti Group are in Schaan in the Principality of Liechtenstein. Almost 29,000 employees, in more than 120 countries around the world, enthuse their customers and build a better future. The corporate culture is founded on integrity, courage, teamwork and commitment."
343,Xoxoday,4.1,271,245,--,"#17 Bhagyalaxmi Square, 2nd Floor, 3rd Sector, HSR Layout",Enterprise Software & Network Solutions,"Xoxoday is a rapidly growing fintech SaaS firm that propels business growth while focusing on human motivation. Backed by Giift and Apis Partners Growth Fund II, Xoxoday offers a suite of three products - Plum, Empuls, and Compass. Xoxoday works with more than 2000 clients across 10+ countries and over 2.5 million users. Headquartered in Bengaluru, Xoxoday is a 290+ member strong team with four global offices in San Francisco, Dublin, Singapore, New Delhi. www.xoxoday.com. Our Products: Plum Plum, a horizontal platform, helps automate rewards, incentives, and payouts programs at scale from the flow of work. Find out more here: https://www.xoxoday.com -------------------- Empuls A vertical platform enabling organizations to build an engaged workplace, where everyone is aligned, motivated, empowered, and connected. Find out more here: https://www.empuls.io/ -------------------- Compass A platform automating and gamifying sales incentives and commissions for sales teams. Find out more here: https://www.getcompass.ai/ --------------------"
344,Times Internet,4.2,1.2T,1.2T,8,Bengaluru,Internet & Web Services,"Times Internet builds premium digital products that simplify and enhance the everyday lives of people. We are India’s largest digital products company with presence in a wide range of categories across news, entertainment, marketplaces and transactions. Many of our products are market leaders and iconic brands in their own right. TOI, ET, Cricbuzz, Gaana, MX Player, Dineout, Indiatimes, MensXP, iDiva, NBT, Gradeup among others are products that bring you closer to your interests and aspirations. Times Internet is an equal opportunity employer. We strongly believe and promote inclusivity and diversity. In 2018, we achieved overall gender pay parity as per an independent audit conducted by Aon Hewitt. We are excited by new possibilities and look forward to bring new products, ideas and solutions that help people make the most of everyday. We would love for you to join us and take us to the next level!"
345,Falabella,4.1,900,93,523,Bengaluru,"Department, Clothing & Shoe Stores","S.A.C.I. Falabella may be more than 100 years old, but Chile's #1 department store chain is hardly showing its age. Falabella runs some 75 department stores, 100-plus Sodimac home improvement stores, and about 55 Tottus supermarkets and hypermarkets in Chile, Peru, Argentina, and Colombia, making it one of Latin America's largest retail companies. More than half of Falabella's stores are in its home country. Additional operations include a bank (with branches in Falabella stores in Chile and Peru, allowing them to stay open longer than other banks), retail financial services (insurance, travel services, credit cards), and shopping center development. Falabella was founded in 1889 by Salvatore Falabella."
346,Airbnb,4.3,2.4T,232,19,Bengaluru,Internet & Web Services,"Founded in August of 2008 and based in San Francisco, California, Airbnb is a trusted community marketplace for people to list, discover, and book unique accommodations around the world — online or from a mobile phone. Whether an apartment for a night, a castle for a week, or a villa for a month, Airbnb connects people to unique travel experiences, at any price point, in more than 34,000 cities and 192 countries. And with world-class customer service and a growing community of users, Airbnb is the easiest way for people to monetize their extra space and showcase it to an audience of millions. Our up-and-coming Gurgaon office is home to a small but strong team of individuals who have an insightful and deep understanding of our Indian business. They are one of the most hospitable teams on the planet and welcome all with open arms."
347,Zinnov Management Consulting,4.0,316,435,8,Bengaluru,Business Consulting,"Zinnov is a global management consulting and strategy advisory firm that works with clients to generate value through custom frameworks, data & insights, and tailored customer-centric strategies. We are trusted advisors and partners to leaders and organizations across the globe in the areas of Globalization, Digital Engineering, Global Talent, and Transformative Technologies."
348,GE Capital,4.0,1.9T,101,2,Bengaluru,Investment & Asset Management,"GE Capital - We’ve completely transformed ourselves into a smaller, simpler company... focused on customers and markets aligned with GE's industrial businesses. GE Capital is the unique industrial partner that can deliver cutting-edge financial solutions while uncovering new opportunities."
349,Wiley Edge,4.1,688,87,17,Bengaluru,Information Technology Support Services,"Our flagship Hire-Train-Deploy offering gives organizations access to custom-built, emerging tech and business talent at scale, allowing organizations to future-proof their teams. Based on Client needs, we find and Hire diverse emerging talent. We Train them at our Academy led by industry practitioners. We then Deploy them on site, giving our Clients access to cutting-edge skills and a pipeline of future talent that can be converted to FTE at the end of the contract."
350,Mott MacDonald,4.1,2.3T,298,201,Bengaluru,Architectural & Engineering Services,
351,IDEMIA,4.0,1.7T,396,113,Bengaluru,Enterprise Software & Network Solutions,"IDEMIA is the global leader in Augmented Identity, with the ambition to provide a secure environment enabling citizens and consumers alike to perform their daily critical activities (such as pay, connect, travel and vote), in the physical as well as digital space. Securing our identity has become mission critical in the world we live in today. By standing for Augmented Identity, we reinvent the way we think, produce, use and protect this asset, whether for individuals or for objects. We ensure privacy and trust as well as guarantee secure, authenticated and verifiable transactions for international clients from Financial, Telecom, Identity, Public Security and IoT sectors. OT (Oberthur Technologies) and Safran Identity & Security (Morpho) have joined forces to form IDEMIA. With close to $3 billion in revenues and 14,000 employees around the world, IDEMIA serves clients in 180 countries."
352,Halodoc,4.2,244,149,--,"5th Floor Shubha Ram Complex, 144, Mahatma Gandhi Rd, Craig Park Layout, Ashok Nagar, Bengaluru, Karnataka 560001, India",Healthcare Services & Hospitals,"Halodoc: Revolutionizing Healthcare, One Tap at a Time! Welcome to Halodoc, where we're rewriting the rules of healthcare by seamlessly connecting millions of patients with licensed doctors, insurance providers, labs, and pharmacies through our innovative mobile application. Our mission? To simplify access to healthcare and empower individuals to take charge of their well-being. With a tap on your smartphone, you can enter a world of transformative possibilities. Need a consultation? Our platform offers 24/7 virtual access to over 20,000 licensed doctors through chat, voice, or video. Running low on medication? Choose from our network of 4,000+ trusted pharmacies for seamless purchase and doorstep delivery. And for those important medical procedures, our platform lets you effortlessly book appointments with over 2,000 providers, covering everything from hospital visits to COVID-19 tests and homecare immunizations. Our dedication to revolutionizing healthcare has garnered widespread acclaim, earning us prestigious accolades on both regional and international stages. From the Global Digital Health 150 in 2020 and 2019 to being recognized as a top digital healthcare company, our commitment to innovation and excellence is clear. We are driven by a passionate team of compassionate, agile, and forward-thinking professionals who are reshaping the healthcare landscape in Indonesia and beyond. But we're not just about cutting-edge technology and medical expertise. At Halodoc, we celebrate diversity and foster a culture of inclusivity and fairness. We believe that a melting pot of perspectives fuels our creativity and enables us to build the most trusted digital healthcare company in Indonesia. So, if you're a digital world enthusiast ready to join us in creating a better world through improved healthcare, buckle up and embark on this extraordinary journey with us. Discover exciting career opportunities at Halodoc by visiting our career page at https://www.halodoc.com/karir or simply send your CV to talent.scout@halodoc.com. Let's together simplify healthcare and make a positive impact on lives through our boundless innovation and unwavering passion. Welcome to Halodoc, where healthcare meets the future!"
353,HackerEarth,4.0,258,266,11,"Indiqube Orion, 24th Main, Agara Village, 1st Sector, HSR Layout",Enterprise Software & Network Solutions,"The journey of HackerEarth had its humble beginning in the dorms of IIT Roorkee at the start of 2012. Born out of curiosity and passion of two budding software engineers, HackerEarth was built on a core tenant that everyone has the potential to change this world, all they need is the right opportunity. HackerEarth provides enterprise software solutions that help organizations in their innovation management and talent assessment endeavours. HackerEarth Recruit is a talent assessment platform that helps in efficient technical talent screening allowing organizations to build strong, proficient teams. HackerEarth Sprint is an innovation management software that helps organizations drive innovation through internal and external talent pools, including HackerEarth’s global community of 4M+ developers. Today, HackerEarth serves 750+ organizations, including leading Fortune 500 companies from around the world. General Electric, IBM, Amazon, Apple, Wipro, Walmart Labs and Bosch are some of the brands that trust HackerEarth in helping them drive growth."
354,Roche,4.1,7.7T,211,1.2T,Bengaluru,Biotech & Pharmaceuticals,
355,Mars,4.3,5T,154,1.4T,Bengaluru,Food & Beverage Manufacturing,"Here at Mars, there’s always a story to tell. From our pet hospitals to farmers in our supply chain, new tales are unfolding every day. Dig into our stories and discover why so many of us are proud to be part of the Mars family!"
356,iEnergizer,4.7,5T,3.9T,5,Bengaluru,Information Technology Support Services,
357,None Such Farm,4.0,526,615,--,Bengaluru,Grocery Stores,
358,HSBC Software Development India,4.1,1.5T,1.7T,--,Bengaluru,N/A,
359,IDC (International Data Corporation),4.0,670,96,8,Bengaluru,Information Technology Support Services,"International Data Corporation (IDC) is the premier global provider of market intelligence, advisory services, and events for the information technology, telecommunications, and consumer technology markets. With more than 1,100 analysts worldwide, IDC offers global, regional, and local expertise on technology and industry opportunities and trends in over 110 countries. IDC's analysis and insight helps IT professionals, business executives, and the investment community to make fact-based technology decisions and to achieve their key business objectives. Founded in 1964, IDC is a wholly-owned subsidiary of International Data Group (IDG), the world's leading tech media, data and marketing services company."
360,Innova Solutions,4.0,1.4T,826,16,Bengaluru,Enterprise Software & Network Solutions,"Innova Solutions, an ACS solutions company -www.acsicorp.com ) is a global information technology company combining a global reach with a local touch. Headquartered in Duluth, Georgia, Innova employs more than 20000 technology professionals worldwide, with field offices in New York, Chennai, Bangalore, Hyderabad, Pune, and Taipei. From Cloud Transformation to Data Services to Managed IT Operations, Innova provides a broad array of proven, tested, cost‑effective, and enterprise‑scale technologies and services that leverage latest technology and delivery models to deliver high value in the cloud, in the data center, and across complex inter‑connected environments. For additional information, visit www.innovasolutions.com"
361,Hyatt,4.0,6.6T,426,4.5T,Bengaluru,Hotels & Resorts,"Hyatt is a leading global hospitality company guided by its purpose – to care for people so they can be their best. Join our Hyatt family of more than 160,000 colleagues in more than 70 countries and you will find a place where, your individuality is celebrated. Our global teams are a mosaic of cultures, ethnicities, genders, ages, and abilities that reflect the world we serve. Our culture is one that empowers every person to be their best, and such authentic connection inspires how we care for each other and for our guests. As of December 31, 2021, Hyatt's portfolio included more than 1,150 hotel and all-inclusive properties in 70 countries across six continents. Each of our brands provides a distinct experience, while all of our hotels deliver genuine care. This sets us apart from the competition and helps us fulfill our aspiration to be the most preferred brand everywhere we serve."
362,Groww,4.2,254,344,1,"Prom's complex, 1st floor, SBI Colony, Koramangala 1A block",Internet & Web Services,"We are making finance simple. For millions in India. Groww is on a mission to democratize access to financial services for millions of Indians responsibly. We are a customer-first company. We believe in crafting the best and most delightful user experience for our customers. And we leverage first principle thinking and technology to solve problems at scale. If this excites you, join us. About Groww Groww is India’s fastest growing investment platform.. Our long term vision to become the trusted money partner of ~100M Indians with core products in investment & banking. Groww was founded in 2016 by alums from Flipkart, ICICI, IITB, IITD, BITs Pilani and is, backed by marquee investors like Tiger Global, Sequoia Capital, Ribbit Captial, and Y Combinator. OUR VALUES We take pride in our values and hold ourselves to a high standard on: - Radical customer centricity - Simplicity in our products and personalities - Transparency on everything - Long term thinking - Ownership driven culture"
363,FactSet,4.1,3.9T,1.5T,89,Bengaluru,Investment & Asset Management,"FactSet creates data and software solutions for tens of thousands of investment professionals around the world, providing instant access to financial data and analytics that investors use to make crucial investment decisions. We combine hundreds of databases from industry-leading suppliers with our clients' own proprietary data to deliver a one-stop source for financial information. Our clients are top financial professionals, working at some of the largest investment firms in the world. For 40 years, through market changes and technological progress, we’ve maintained our focus on providing exceptional client service. Every job function and department contributes to our overall goal of adding value to our clients’ workflows. Our client retention rate has remained at an astounding 95% for more than 15 years, a testament to the high degree of service and quality for which we’ve become known."
364,Sonus Networks,4.0,344,210,9,Bengaluru,Electronics Manufacturing,"Sonus brings the next generation of Cloud-based SIP and 4G/VoLTE solutions to its customers by enabling and securing mission critical traffic for VoIP, video, IM and online collaboration. With Sonus, enterprises can intelligently secure and prioritize real-time communications, while service providers can deliver reliable, secure real-time services for mobile, UC and social applications. Sonus offers an award-winning portfolio of hardware-based and virtualized Session Border Controllers (SBCs), Diameter Signaling Controllers (DSCs), Cloud Exchange Networking Platform, Policy/Routing servers and media/signaling gateways."
365,Mouser Electronics,4.1,494,110,81,Bengaluru,Electronics Manufacturing,"Mouser Electronics, a Berkshire Hathaway company, is an authorized semiconductor and electronic component distributor focused on New Product Introductions from its leading manufacturer partners. Serving the global electronic design engineer and buyer community, the global distributor's website, mouser.com, is available in multiple languages and currencies and features more than 6.8 million products from over 1,200 manufacturer brands. Mouser offers 27 support locations worldwide to provide best-in-class customer service in local language, currency and time zone. The distributor ships to over 650,000 customers in 223 countries/territories from its 1 million-square-foot, state-of-the-art distribution facilities in the Dallas, Texas, metro area. For more information, visit https://www.mouser.com."
366,Databricks,4.5,971,49,437,"Block L, Embassy TechVillage Outer Ring Rd",Computer Hardware Development,"Databricks is the data and AI company. More than 5,000 organizations worldwide — including Comcast, Condé Nast, H&M, and over 40% of the Fortune 500 — rely on the Databricks Lakehouse Platform to unify their data, analytics and AI. Databricks is headquartered in San Francisco, with offices around the globe. Founded by the original creators of Apache Spark™, Delta Lake and MLflow, Databricks is on a mission to help data teams solve the world's toughest problems. To learn more, follow Databricks on Twitter, LinkedIn and Facebook."
367,Aston Carter,4.2,1.7T,371,2.3T,Bengaluru,HR Consulting,"Established in 1997, Aston Carter is a leading staffing and consulting firm, providing high-caliber talent and premium services to more than 7,000 companies across North America. Spanning four continents and more than 200 offices, we extend our clients’ capabilities by seeking solvers and delivering solutions to address today’s workforce challenges. Specializing in accounting and finance; governance, risk and compliance; customer support; and operations and administrative roles, we're here to connect organizations and professionals to drive innovative solutions shaped by critical-thinking professionals. To learn more, visit AstonCarter.com. Aston Carter is a company within Allegis Group, a global leader in talent solutions. To learn more visit www.astoncarter.com."
